place,title,time,pay,date
경기 시흥시, 세븐일레븐 시흥은행2점,08:00~16:00,"시급8,590",1분전
서울 강서구, 세븐일레븐 마곡15단지점,09:00~15:00,"시급8,600",2분전
서울 양천구, 세븐일레븐 S오목교역점,06:30~12:30,"시급8,590",2분전
대구 중구, 세븐일레븐 대구삼덕본점,23:00~08:00,"시급8,590",8분전
광주 광산구, 세븐일레븐 광주월곡희망점,24:00~09:00,"시급8,590",8분전
경기 성남시, 세븐일레븐 분당제생병원점,19:00~22:00,"시급8,590",14분전
서울 강서구, 세븐일레븐 내발산점,19:00~24:00,"시급8,590",17분전
충북 전체, 세븐일레븐 청주산남원룸점,23:00~06:00,"시급8,590",18분전
경기 부천시, 세븐일레븐 중동한신점,24:00~06:00,"시급8,590",20분전
경기 수원시, 세븐일레븐 수원정자본점,22:00~07:00,"시급8,600",20분전
인천 중구, 세븐일레븐 인천영종운남점,22:00~06:00,"시급8,590",22분전
경남 김해시, 세븐일레븐 장유율하자이힐점,01:00~00:00,"시급8,590",24분전
서울 송파구, 세븐일레븐 삼전일등점,22:00~10:00,"시급8,590",27분전
충북 청주시, 세븐일레븐 청주가경센터점,22:00~08:00,"시급8,590",27분전
부산 강서구, 세븐일레븐 부산생곡공단점,12:30~22:30,"시급8,590",33분전
대구 수성구, 세븐일레븐 대구만촌송은점,17:00~24:00,"시급8,590",34분전
인천 부평구, 세븐일레븐 인천부평북초교점,17:00~22:00,"시급8,600",34분전
경기 남양주, 세븐일레븐 남양주오남점,23:00~08:00,"시급8,590",36분전
경기 안양시, 세븐일레븐 평촌효성점,09:00~21:00,"시급8,590",36분전
서울 관악구, 세븐일레븐 관악남현점,15:30~22:30,"시급8,590",37분전
대전 동구, 세븐일레븐 대전판암본점,23:00~06:00,"시급8,590",37분전
경기 수원시, 세븐일레븐 수원천천대우점,23:00~06:00,"시급8,590",47분전
서울 동대문, 세븐일레븐 용두역점,23:00~06:00,"시급8,590",48분전
경기 광명시, 세븐일레븐 광명소원점,01:00~06:00,"시급8,590",50분전
서울 금천구, 세븐일레븐 금천리온점,16:00~23:00,"시급8,590",52분전
부산 사상구, 세븐일레븐 부산사상새벽로점,08:00~16:00,"시급8,590",56분전
충남 보령시, 세븐일레븐 보령명천스타점,06:00~14:00,"시급8,590",57분전
울산 북구, 세븐일레븐 울산현대자동차점,23:00~07:00,"시급8,590",57분전
경기 화성시, 세븐일레븐 화성버들로점,09:00~05:00,"시급9,000",57분전
서울 강동구, 세븐일레븐 명일삼익점,21:00~07:00,"시급8,590",58분전
서울 강동구, 세븐일레븐 명일삼익점,21:00~07:00,"시급8,590",58분전
충남 보령시, 세븐일레븐 보령명천스타점,06:00~24:00,"시급8,590",59분전
충북 진천군, 세븐일레븐 진천덕산용몽점,18:00~01:00,"시급8,590",1시간전
경기 수원시, 세븐일레븐 서수원푸르지오점,00:00~08:00,"시급8,590",1시간전
대전 전체, 세븐일레븐 대전성남점,23:00~09:00,"시급8,590",1시간전
대구 수성구, 세븐일레븐 대구범어푸르지오점,09:00~17:00,"시급8,590",1시간전
전남 여수시, 세븐일레븐 여수학동엑스포점,22:00~08:00,"시급8,590",1시간전
경기 시흥시, 세븐일레븐 시흥CMI점,15:00~22:00,"시급8,590",2시간전
경기 고양시, 세븐일레븐 고양화정동점,00:00~07:00,"시급8,590",2시간전
충남 천안시, 세븐일레븐 천안북면점,22:00~06:00,"시급8,590",2시간전
충북 전체, 세븐일레븐 청주산남원룸점,23:00~06:00,"시급8,590",2시간전
광주 북구, 세븐일레븐 광주각화골드점,23:00~08:00,"시급8,590",2시간전
경기 시흥시, 세븐일레븐 시흥CMI점,15:00~22:00,"시급8,590",2시간전
서울 송파구, 세븐일레븐 롯데월드어드벤처점,14:00~22:00,"시급8,590",2시간전
충남 천안시, 세븐일레븐 천안원성목화점,16:00~24:00,"시급8,590",2시간전
서울 강남구, 세븐일레븐 세곡리엔점,16:00~02:00,"시급8,590",2시간전
대전 전체, 세븐일레븐 대전월평3호점,22:00~08:00,"시급8,590",2시간전
부산 연제구, 세븐일레븐 부산연산연동점,22:00~02:30,"시급8,590",2시간전
대전 동구, 세븐일레븐 대전판암본점,06:00~15:00,"시급8,590",2시간전
경기 평택시, 세븐일레븐 평택서재원룸점,22:00~08:00,"시급8,590",2시간전
